{
  "platform": "EBAY_AU",
  "listing_id": "ebay_au:198170918806",
  "url": "https://www.ebay.com.au/itm/198170918806",
  "title": "Dell Precision 7750 Laptop 17.3\u201d 32GB RAM |  1 TB SSD | 16GB GPU",
  "price_aud": 1200.0,
  "seller_name": "zinc_techno",
  "seller_rating": null,
  "condition_code": null,
  "condition_label": "Used",
  "shipping_type": null,
  "pickup_location_text": null,
  "category_path": "Computers/Tablets & Networking > Laptops & Netbooks",
  "full_listing_text": "Dell Precision 7750 Laptop 17.3\u201d 32GB RAM |  1 TB SSD | 16GB GPU",
  "scraped_at": "2026-07-04T08:12:18.549389Z",
  "gpu_name": null,
  "vram_capacity": 16,
  "cpu_name": null,
  "total_system_ram": 32,
  "storage": "1 TB SSD",
  "egpu_model": null,
  "touchscreen_digitizer": null,
  "exact_model_name": "Precision 7750"
}