{
  "platform": "EBAY_AU",
  "listing_id": "ebay_au:277283436885",
  "url": "https://www.ebay.com.au/itm/277283436885",
  "title": "AORUS 17X AZF 17.3\" 2560x1440 240Hz i9-13950HX 32GB 2TB SSD RTX 4090 W11H",
  "price_aud": 3974.54,
  "seller_name": "AVE_Electronics",
  "seller_rating": null,
  "condition_code": null,
  "condition_label": "Very Good - Refurbished",
  "shipping_type": null,
  "pickup_location_text": null,
  "category_path": "Computers/Tablets & Networking > Laptops & Netbooks",
  "full_listing_text": "AORUS 17X AZF 17.3\" 2560x1440 240Hz i9-13950HX 32GB 2TB SSD RTX 4090 W11H",
  "scraped_at": "2026-07-04T08:12:18.455921Z",
  "gpu_name": "RTX 4090",
  "vram_capacity": 16,
  "cpu_name": "i9-13950HX",
  "total_system_ram": 32,
  "storage": "2TB SSD",
  "egpu_model": null,
  "touchscreen_digitizer": null,
  "exact_model_name": "AORUS 17X AZF"
}