{
  "platform": "EBAY_AU",
  "listing_id": "ebay_au:366227557173",
  "url": "https://www.ebay.com.au/itm/366227557173",
  "title": "Dell Precision 7750 17\" FHD Xeon W-10885 2.4GHz 128GB 2TB RTX 5000 W11P",
  "price_aud": 3488.46,
  "seller_name": "neuralsystems",
  "seller_rating": null,
  "condition_code": null,
  "condition_label": "Used",
  "shipping_type": null,
  "pickup_location_text": null,
  "category_path": "Computers/Tablets & Networking > Laptops & Netbooks",
  "full_listing_text": "Dell Precision 7750 17\" FHD Xeon W-10885 2.4GHz 128GB 2TB RTX 5000 W11P",
  "scraped_at": "2026-07-04T08:12:18.657112Z",
  "gpu_name": "RTX 5000",
  "vram_capacity": 16,
  "cpu_name": "Xeon W-10885",
  "total_system_ram": 128,
  "storage": "2TB",
  "egpu_model": null,
  "touchscreen_digitizer": null,
  "exact_model_name": "Precision 7750"
}