{
  "platform": "EBAY_AU",
  "listing_id": "ebay_au:358683915614",
  "url": "https://www.ebay.com.au/itm/358683915614",
  "title": "Dell Precision 7670 16\" i9-12950HX RTX 3080 Ti 16GB 8GB RAM 512GB SSD Win11 Pro",
  "price_aud": 1695.17,
  "seller_name": "igpered-0",
  "seller_rating": null,
  "condition_code": null,
  "condition_label": "Used",
  "shipping_type": null,
  "pickup_location_text": null,
  "category_path": "Computers/Tablets & Networking > Laptops & Netbooks",
  "full_listing_text": "Dell Precision 7670 16\" i9-12950HX RTX 3080 Ti 16GB 8GB RAM 512GB SSD Win11 Pro",
  "scraped_at": "2026-07-04T08:12:18.464404Z",
  "gpu_name": "RTX 3080 Ti",
  "vram_capacity": 16,
  "cpu_name": "i9-12950HX",
  "total_system_ram": 8,
  "storage": "512GB SSD",
  "egpu_model": null,
  "touchscreen_digitizer": null,
  "exact_model_name": "Precision 7670"
}