{
  "platform": "EBAY_AU",
  "listing_id": "ebay_au:298378728125",
  "url": "https://www.ebay.com.au/itm/298378728125",
  "title": "Acer Predator Triton 17 X QHD+ 2.2GHz i9-13900HX 64GB 2TB SSD RTX 4090 Very Good",
  "price_aud": null,
  "seller_name": "ItsWorthMore",
  "seller_rating": null,
  "condition_code": null,
  "condition_label": null,
  "shipping_type": null,
  "pickup_location_text": null,
  "category_path": "Computers/Tablets & Networking > Laptops & Netbooks",
  "full_listing_text": "Acer Predator Triton 17 X QHD+ 2.2GHz i9-13900HX 64GB 2TB SSD RTX 4090 Very Good",
  "scraped_at": "2026-07-04T08:12:18.496237Z",
  "gpu_name": "RTX 4090",
  "vram_capacity": 16,
  "cpu_name": "i9-13900HX",
  "total_system_ram": 64,
  "storage": "2TB SSD",
  "egpu_model": null,
  "touchscreen_digitizer": null,
  "exact_model_name": "Predator Triton 17 X"
}