{
  "platform": "EBAY_AU",
  "listing_id": "ebay_au:116762331758",
  "url": "https://www.ebay.com.au/itm/116762331758",
  "title": "Razer Blade Pro 17 17.3\" Intel Core i7-10875H Gaming Laptop",
  "price_aud": 2299.0,
  "seller_name": "pandselectronics",
  "seller_rating": null,
  "condition_code": null,
  "condition_label": "Opened \u2013 never used",
  "shipping_type": null,
  "pickup_location_text": null,
  "category_path": "Computers/Tablets & Networking > Laptops & Netbooks",
  "full_listing_text": "Razer Blade Pro 17 17.3\" Intel Core i7-10875H Gaming Laptop",
  "scraped_at": "2026-07-04T08:12:18.706580Z",
  "gpu_name": null,
  "vram_capacity": null,
  "cpu_name": "Core i7-10875H",
  "total_system_ram": null,
  "storage": null,
  "egpu_model": null,
  "touchscreen_digitizer": null,
  "exact_model_name": "Razer Blade Pro 17"
}