{
  "platform": "EBAY_AU",
  "listing_id": "ebay_au:267691382054",
  "url": "https://www.ebay.com.au/itm/267691382054",
  "title": "Gigabyte Aorus Master 18\" U9 275HX RTX 5090 32GB 2TB QHD 240Hz Mini LED Laptop",
  "price_aud": 5205.52,
  "seller_name": "geoff_lee367",
  "seller_rating": null,
  "condition_code": null,
  "condition_label": "Used",
  "shipping_type": null,
  "pickup_location_text": null,
  "category_path": "Computers/Tablets & Networking > Laptops & Netbooks",
  "full_listing_text": "Gigabyte Aorus Master 18\" U9 275HX RTX 5090 32GB 2TB QHD 240Hz Mini LED Laptop",
  "scraped_at": "2026-07-04T08:12:18.537382Z",
  "gpu_name": "RTX 5090",
  "vram_capacity": 24,
  "cpu_name": "U9 275HX",
  "total_system_ram": 32,
  "storage": "2TB",
  "egpu_model": null,
  "touchscreen_digitizer": null,
  "exact_model_name": "Aorus Master 18"
}