{
  "platform": "EBAY_AU",
  "listing_id": "ebay_au:278082458240",
  "url": "https://www.ebay.com.au/itm/278082458240",
  "title": "Lenovo ThinkPad P15 Gen 2 FHD i7-11800H 2.30GHz 32GB 1TB SSD RTX A4000 Very Good",
  "price_aud": 1427.73,
  "seller_name": "itsworthmore",
  "seller_rating": null,
  "condition_code": null,
  "condition_label": "Very Good - Refurbished",
  "shipping_type": null,
  "pickup_location_text": null,
  "category_path": "Computers/Tablets & Networking > Laptops & Netbooks",
  "full_listing_text": "Lenovo ThinkPad P15 Gen 2 FHD i7-11800H 2.30GHz 32GB 1TB SSD RTX A4000 Very Good",
  "scraped_at": "2026-07-04T08:12:18.562217Z",
  "gpu_name": "RTX A4000",
  "vram_capacity": 8,
  "cpu_name": "i7-11800H",
  "total_system_ram": 32,
  "storage": "1TB SSD",
  "egpu_model": null,
  "touchscreen_digitizer": null,
  "exact_model_name": "ThinkPad P15 Gen 2"
}