{
  "platform": "EBAY_AU",
  "listing_id": "ebay_au:277903442793",
  "url": "https://www.ebay.com.au/itm/277903442793",
  "title": "Acer Predator Triton 14 AI 14 120Hz TOUCH 3.3GHz Ultra 9 288V 32GB 2TB RTX 5070",
  "price_aud": 2823.75,
  "seller_name": "itsworthmore",
  "seller_rating": null,
  "condition_code": null,
  "condition_label": "Excellent - Refurbished",
  "shipping_type": null,
  "pickup_location_text": null,
  "category_path": "Computers/Tablets & Networking > Laptops & Netbooks",
  "full_listing_text": "Acer Predator Triton 14 AI 14 120Hz TOUCH 3.3GHz Ultra 9 288V 32GB 2TB RTX 5070",
  "scraped_at": "2026-07-04T08:12:18.593965Z",
  "gpu_name": "RTX 5070",
  "vram_capacity": 16,
  "cpu_name": "Ultra 9 288V",
  "total_system_ram": 32,
  "storage": "2TB",
  "egpu_model": null,
  "touchscreen_digitizer": true,
  "exact_model_name": "Predator Triton 14 AI"
}