{
  "platform": "EBAY_AU",
  "listing_id": "ebay_au:366496934240",
  "url": "https://www.ebay.com.au/itm/366496934240",
  "title": "MSI Stealth A18 HX AI+ GeForce Ultra 9 64G 2TB RTX 5090 Win 11 Pro (Like New!!)",
  "price_aud": null,
  "seller_name": "m48749",
  "seller_rating": null,
  "condition_code": null,
  "condition_label": null,
  "shipping_type": null,
  "pickup_location_text": null,
  "category_path": "Computers/Tablets & Networking > Laptops & Netbooks",
  "full_listing_text": "MSI Stealth A18 HX AI+ GeForce Ultra 9 64G 2TB RTX 5090 Win 11 Pro (Like New!!)",
  "scraped_at": "2026-07-04T08:12:18.492229Z",
  "gpu_name": "RTX 5090",
  "vram_capacity": 24,
  "cpu_name": "Ultra 9",
  "total_system_ram": 64,
  "storage": "2TB",
  "egpu_model": null,
  "touchscreen_digitizer": null,
  "exact_model_name": "Stealth A18 HX AI+"
}