{
  "platform": "EBAY_AU",
  "listing_id": "ebay_au:366395675100",
  "url": "https://www.ebay.com.au/itm/366395675100",
  "title": "HyperX OMEN MAX Gaming Laptop 16\" 2.5K OLED Ultra 9 290HX 32GB 1TB SSD RTX5090",
  "price_aud": 5799.0,
  "seller_name": "HP Official Store",
  "seller_rating": null,
  "condition_code": null,
  "condition_label": "Brand New",
  "shipping_type": null,
  "pickup_location_text": null,
  "category_path": "Computers/Tablets & Networking > Laptops & Netbooks",
  "full_listing_text": "HyperX OMEN MAX Gaming Laptop 16\" 2.5K OLED Ultra 9 290HX 32GB 1TB SSD RTX5090",
  "scraped_at": "2026-07-04T08:12:18.480741Z",
  "gpu_name": "RTX 5090",
  "vram_capacity": 24,
  "cpu_name": "Ultra 9 290HX",
  "total_system_ram": 32,
  "storage": "1TB SSD",
  "egpu_model": null,
  "touchscreen_digitizer": null,
  "exact_model_name": "OMEN MAX"
}