{
  "platform": "EBAY_AU",
  "listing_id": "ebay_au:358672186388",
  "url": "https://www.ebay.com.au/itm/358672186388",
  "title": "Acer Predator Helios 18\u201d Gaming Laptop, 250Hz, RTX 4090, I9-14900HX, 32GB, 1TB",
  "price_aud": 3656.59,
  "seller_name": "Laptop-Goods",
  "seller_rating": null,
  "condition_code": null,
  "condition_label": "Excellent - Refurbished",
  "shipping_type": null,
  "pickup_location_text": null,
  "category_path": "Computers/Tablets & Networking > Laptops & Netbooks",
  "full_listing_text": "Acer Predator Helios 18\u201d Gaming Laptop, 250Hz, RTX 4090, I9-14900HX, 32GB, 1TB",
  "scraped_at": "2026-07-04T08:12:18.452356Z",
  "gpu_name": "RTX 4090",
  "vram_capacity": 16,
  "cpu_name": "I9-14900HX",
  "total_system_ram": 32,
  "storage": "1TB",
  "egpu_model": null,
  "touchscreen_digitizer": null,
  "exact_model_name": "Predator Helios 18"
}