{
  "platform": "EBAY_AU",
  "listing_id": "ebay_au:127719846029",
  "url": "https://www.ebay.com.au/itm/127719846029",
  "title": "Dell Precision 7560 15\" Touch FHD Core Xenon 10th1.5 TB SSD 64GB 16 GB RTX A4000",
  "price_aud": 1976.3,
  "seller_name": "prabhat.business",
  "seller_rating": null,
  "condition_code": null,
  "condition_label": "Used",
  "shipping_type": null,
  "pickup_location_text": null,
  "category_path": "Computers/Tablets & Networking > Laptops & Netbooks",
  "full_listing_text": "Dell Precision 7560 15\" Touch FHD Core Xenon 10th1.5 TB SSD 64GB 16 GB RTX A4000",
  "scraped_at": "2026-07-04T08:12:18.520426Z",
  "gpu_name": "RTX A4000",
  "vram_capacity": 16,
  "cpu_name": "Core Xenon 10th",
  "total_system_ram": 64,
  "storage": "1.5 TB SSD",
  "egpu_model": null,
  "touchscreen_digitizer": true,
  "exact_model_name": "Precision 7560"
}