{
  "platform": "EBAY_AU",
  "listing_id": "ebay_au:178214868301",
  "url": "https://www.ebay.com.au/itm/178214868301",
  "title": "Asus Rog Flow Z13 GZ302EA Ryzen AI MAX+ 395 32GB RAM 1TB SSD 13.4\" 2.5K Touch",
  "price_aud": null,
  "seller_name": "treasure_pc_online",
  "seller_rating": null,
  "condition_code": null,
  "condition_label": null,
  "shipping_type": null,
  "pickup_location_text": null,
  "category_path": "Computers/Tablets & Networking > Laptops & Netbooks",
  "full_listing_text": "Asus Rog Flow Z13 GZ302EA Ryzen AI MAX+ 395 32GB RAM 1TB SSD 13.4\" 2.5K Touch",
  "scraped_at": "2026-07-04T08:12:18.512721Z",
  "gpu_name": null,
  "vram_capacity": null,
  "cpu_name": "Ryzen AI MAX+ 395",
  "total_system_ram": 32,
  "storage": "1TB SSD",
  "egpu_model": null,
  "touchscreen_digitizer": true,
  "exact_model_name": "Rog Flow Z13 GZ302EA"
}