{
  "platform": "EBAY_AU",
  "listing_id": "ebay_au:336085396364",
  "url": "https://www.ebay.com.au/itm/336085396364",
  "title": "Alienware Aurora R12 Gaming PC i9-11900KF 32GB RAM 1TB SSD 2TB HDD RTX 3090 24GB",
  "price_aud": null,
  "seller_name": "Technology Locker",
  "seller_rating": null,
  "condition_code": null,
  "condition_label": null,
  "shipping_type": null,
  "pickup_location_text": null,
  "category_path": "Computers/Tablets & Networking > Laptops & Netbooks",
  "full_listing_text": "Alienware Aurora R12 Gaming PC i9-11900KF 32GB RAM 1TB SSD 2TB HDD RTX 3090 24GB",
  "scraped_at": "2026-07-03T20:47:54.907876Z",
  "gpu_name": "RTX 3090",
  "vram_capacity": 24,
  "cpu_name": "i9-11900KF",
  "total_system_ram": 32,
  "storage": "1TB SSD 2TB HDD",
  "egpu_model": null,
  "touchscreen_digitizer": null,
  "exact_model_name": "Alienware Aurora R12"
}