{
  "platform": "EBAY_AU",
  "listing_id": "ebay_au:188296491379",
  "url": "https://www.ebay.com.au/itm/188296491379",
  "title": "Dell Precision 7670 Intel i7 12850HX 4.80GHz 32GB RAM 1TB SSD RTX A3000 16\" Win",
  "price_aud": 1249.0,
  "seller_name": "bneacttrader",
  "seller_rating": null,
  "condition_code": null,
  "condition_label": null,
  "shipping_type": null,
  "pickup_location_text": null,
  "category_path": "Computers/Tablets & Networking > Laptops & Netbooks",
  "full_listing_text": "Dell Precision 7670 Intel i7 12850HX 4.80GHz 32GB RAM 1TB SSD RTX A3000 16\" Win",
  "scraped_at": "2026-07-04T08:12:18.621797Z",
  "gpu_name": "RTX A3000",
  "vram_capacity": 12,
  "cpu_name": "i7 12850HX",
  "total_system_ram": 32,
  "storage": "1TB SSD",
  "egpu_model": null,
  "touchscreen_digitizer": null,
  "exact_model_name": "Precision 7670"
}