{
  "platform": "EBAY_AU",
  "listing_id": "ebay_au:366348476691",
  "url": "https://www.ebay.com.au/itm/366348476691",
  "title": "HP OMEN MAX Gaming Laptop 16\"WQXGA AI 9 HX 375 32GB 1TBSSD RTX5080",
  "price_aud": 4249.0,
  "seller_name": "hp_official",
  "seller_rating": null,
  "condition_code": null,
  "condition_label": "Brand New",
  "shipping_type": null,
  "pickup_location_text": null,
  "category_path": "Computers/Tablets & Networking > Laptops & Netbooks",
  "full_listing_text": "HP OMEN MAX Gaming Laptop 16\"WQXGA AI 9 HX 375 32GB 1TBSSD RTX5080",
  "scraped_at": "2026-07-04T08:12:18.484825Z",
  "gpu_name": "RTX 5080",
  "vram_capacity": 16,
  "cpu_name": "AI 9 HX 375",
  "total_system_ram": 32,
  "storage": "1TBSSD",
  "egpu_model": null,
  "touchscreen_digitizer": null,
  "exact_model_name": "OMEN MAX"
}