{
  "platform": "EBAY_AU",
  "listing_id": "ebay_au:377293014280",
  "url": "https://www.ebay.com.au/itm/377293014280",
  "title": "Acer Predator Triton 14 AI Gaming Laptop Touch Ultra 9 32GB RAM 2TB SSD RTX 5070",
  "price_aud": 2451.69,
  "seller_name": "jestev-6612",
  "seller_rating": null,
  "condition_code": null,
  "condition_label": "Brand New",
  "shipping_type": null,
  "pickup_location_text": null,
  "category_path": "Computers/Tablets & Networking > Laptops & Netbooks",
  "full_listing_text": "Acer Predator Triton 14 AI Gaming Laptop Touch Ultra 9 32GB RAM 2TB SSD RTX 5070",
  "scraped_at": "2026-07-04T08:12:18.652858Z",
  "gpu_name": "RTX 5070",
  "vram_capacity": 16,
  "cpu_name": "Ultra 9",
  "total_system_ram": 32,
  "storage": "2TB SSD",
  "egpu_model": null,
  "touchscreen_digitizer": true,
  "exact_model_name": "Predator Triton 14 AI"
}