{
  "platform": "EBAY_AU",
  "listing_id": "ebay_au:236740339258",
  "url": "https://www.ebay.com.au/itm/236740339258",
  "title": "ASUS ROG ZEPHYRUS DUO 16.0\" LAPTOP RYZEN 7 6800H 3.20GHz RTX-3070Ti 32GB 512GB",
  "price_aud": 2311.2,
  "seller_name": "faieq32",
  "seller_rating": null,
  "condition_code": null,
  "condition_label": "Used",
  "shipping_type": null,
  "pickup_location_text": null,
  "category_path": "Computers/Tablets & Networking > Laptops & Netbooks",
  "full_listing_text": "ASUS ROG ZEPHYRUS DUO 16.0\" LAPTOP RYZEN 7 6800H 3.20GHz RTX-3070Ti 32GB 512GB",
  "scraped_at": "2026-07-04T08:12:18.541097Z",
  "gpu_name": "RTX 3070 Ti",
  "vram_capacity": 8,
  "cpu_name": "RYZEN 7 6800H",
  "total_system_ram": 32,
  "storage": "512GB",
  "egpu_model": null,
  "touchscreen_digitizer": null,
  "exact_model_name": "ROG ZEPHYRUS DUO 16.0"
}