{
  "platform": "EBAY_AU",
  "listing_id": "ebay_au:227393223086",
  "url": "https://www.ebay.com.au/itm/227393223086",
  "title": "Acer Predator Helios 18 i9-14900HX 2.2GHz 64GB RAM 1TB SSD GeForce RTX 4080",
  "price_aud": null,
  "seller_name": "PayMore Fort Thomas",
  "seller_rating": null,
  "condition_code": null,
  "condition_label": null,
  "shipping_type": null,
  "pickup_location_text": null,
  "category_path": "Computers/Tablets & Networking > Laptops & Netbooks",
  "full_listing_text": "Acer Predator Helios 18 i9-14900HX 2.2GHz 64GB RAM 1TB SSD GeForce RTX 4080",
  "scraped_at": "2026-07-04T08:12:18.500204Z",
  "gpu_name": "RTX 4080",
  "vram_capacity": 12,
  "cpu_name": "i9-14900HX",
  "total_system_ram": 64,
  "storage": "1TB SSD",
  "egpu_model": null,
  "touchscreen_digitizer": null,
  "exact_model_name": "Predator Helios 18"
}