{
  "platform": "EBAY_AU",
  "listing_id": "ebay_au:357485578512",
  "url": "https://www.ebay.com.au/itm/357485578512",
  "title": "ASUS TUF Gaming A18 FA808UP-S8017 / FreeDOS 18\" RTX5070 AMD 7 260 16GB/512GB",
  "price_aud": 2853.2,
  "seller_name": "dw_store13",
  "seller_rating": null,
  "condition_code": null,
  "condition_label": "Brand New",
  "shipping_type": null,
  "pickup_location_text": null,
  "category_path": "Computers/Tablets & Networking > Laptops & Netbooks",
  "full_listing_text": "ASUS TUF Gaming A18 FA808UP-S8017 / FreeDOS 18\" RTX5070 AMD 7 260 16GB/512GB",
  "scraped_at": "2026-07-04T08:12:18.607995Z",
  "gpu_name": "RTX 5070",
  "vram_capacity": 16,
  "cpu_name": "AMD 7 260",
  "total_system_ram": 16,
  "storage": "512GB",
  "egpu_model": null,
  "touchscreen_digitizer": null,
  "exact_model_name": "TUF Gaming A18 FA808UP-S8017"
}