{
  "platform": "EBAY_AU",
  "listing_id": "ebay_au:326825976757",
  "url": "https://www.ebay.com.au/itm/326825976757",
  "title": "ThinkPad P15 Gen 2 i9 5.0GHz RTX A5000 4K UHD HDR 600Nits 64GB 2TB Premier+ADP",
  "price_aud": 3344.95,
  "seller_name": "ThinkPad Machines and Accessories",
  "seller_rating": null,
  "condition_code": null,
  "condition_label": "Brand New",
  "shipping_type": null,
  "pickup_location_text": null,
  "category_path": "Computers/Tablets & Networking > Laptops & Netbooks",
  "full_listing_text": "ThinkPad P15 Gen 2 i9 5.0GHz RTX A5000 4K UHD HDR 600Nits 64GB 2TB Premier+ADP",
  "scraped_at": "2026-07-04T08:12:18.472988Z",
  "gpu_name": "RTX A5000",
  "vram_capacity": 16,
  "cpu_name": "i9",
  "total_system_ram": 64,
  "storage": "2TB",
  "egpu_model": null,
  "touchscreen_digitizer": null,
  "exact_model_name": "ThinkPad P15 Gen 2"
}