{
  "platform": "EBAY_AU",
  "listing_id": "ebay_au:188023133892",
  "url": "https://www.ebay.com.au/itm/188023133892",
  "title": "Dell Precision 7760 Intel i5 11500H 2.90GHz 32GB RAM 256GB SSD 17.3\" Win 11 - B",
  "price_aud": 802.0,
  "seller_name": "bneacttrader",
  "seller_rating": null,
  "condition_code": null,
  "condition_label": null,
  "shipping_type": null,
  "pickup_location_text": null,
  "category_path": "Computers/Tablets & Networking > Laptops & Netbooks",
  "full_listing_text": "Dell Precision 7760 Intel i5 11500H 2.90GHz 32GB RAM 256GB SSD 17.3\" Win 11 - B",
  "scraped_at": "2026-07-04T08:12:18.516427Z",
  "gpu_name": null,
  "vram_capacity": null,
  "cpu_name": "i5 11500H",
  "total_system_ram": 32,
  "storage": "256GB SSD",
  "egpu_model": null,
  "touchscreen_digitizer": null,
  "exact_model_name": "Precision 7760"
}