{
  "platform": "EBAY_AU",
  "listing_id": "ebay_au:267710656346",
  "url": "https://www.ebay.com.au/itm/267710656346",
  "title": "Razer Blade 18 Ultra 9 275HX RTX 5090 64GB 4TB UHD 240Hz/FHD 440Hz Gaming Laptop",
  "price_aud": 7324.68,
  "seller_name": "Pandota",
  "seller_rating": null,
  "condition_code": null,
  "condition_label": "Opened \u2013 never used",
  "shipping_type": null,
  "pickup_location_text": null,
  "category_path": "Computers/Tablets & Networking > Laptops & Netbooks",
  "full_listing_text": "Razer Blade 18 Ultra 9 275HX RTX 5090 64GB 4TB UHD 240Hz/FHD 440Hz Gaming Laptop",
  "scraped_at": "2026-07-04T08:12:18.429786Z",
  "gpu_name": "RTX 5090",
  "vram_capacity": 24,
  "cpu_name": "Ultra 9 275HX",
  "total_system_ram": 64,
  "storage": "4TB",
  "egpu_model": null,
  "touchscreen_digitizer": null,
  "exact_model_name": "Razer Blade 18"
}